{
  "schemaVersion": "0.1",
  "source": "github",
  "deliveryId": "8f1c7e00-b5f1-11f0-8a1b-6c3e2d7a9b42",
  "externalRef": "mmkdigitalio/hackathon-platform-team#42",
  "eventType": "issue-commented",
  "severity": "unknown",
  "state": "commented",
  "occurredAt": "2026-10-30T09:27:00Z",
  "sourceRef": {
    "type": "github-comment",
    "url": "https://github.com/mmkdigitalio/hackathon-platform-team/issues/42#issuecomment-7000002",
    "payloadSha256": "b06138d42456a1d3e41a5154533d7cd7ecc070d2a790ec2509b58c014da8ac56"
  },
  "appId": "affine",
  "environment": "staging",
  "receivedAt": "2026-10-30T09:27:01+00:00",
  "mappingError": null
}
