{
  "schemaVersion": "0.1",
  "source": "azure-monitor",
  "deliveryId": "/subscriptions/00000000-0000-0000-0000-000000000000/providers/Microsoft.AlertsManagement/alerts/11111111-1111-1111-1111-111111111111:Fired",
  "externalRef": "/subscriptions/00000000-0000-0000-0000-000000000000/providers/Microsoft.AlertsManagement/alerts/11111111-1111-1111-1111-111111111111",
  "eventType": "alert",
  "severity": "error",
  "state": "fired",
  "occurredAt": "2026-10-30T09:12:00.000Z",
  "sourceRef": {
    "type": "azure-alert",
    "payloadSha256": "326cf806d5d7ec2b6f58ba193f579a59b0a77a1205006a66f07e2a3e7ab54f52"
  },
  "appId": "affine",
  "environment": "staging",
  "receivedAt": "2026-10-30T09:12:03+00:00",
  "mappingError": null
}
